{
  "schema_id": "neo.models.catalog.v1",
  "version": "0.10.0-image1-artifact-compatibility",
  "catalog": {
    "id": "neo-model-guide-public-preview",
    "display_name": "Neo Model Guide",
    "status": "phase4_6_voice_model_lifecycle_unification",
    "updated_at": "2026-09-18",
    "description": "Curated Neo Studio model source manifest for Image, Video, LLM, Voice, ControlNet/IPAdapter, VAE, text encoders, GGUF variants, repository snapshots, and utility assets. Voice repository snapshots may declare a minimal provider-required materialization through allow_patterns.",
    "policy": "The manifest declares model identity, grouping, source intent, install strategy, and optional provider-required snapshot materialization. Machine-specific cache state, tokens, installed scans, and download state remain runtime data under neo_data or Hugging Face cache ownership; Generate never installs model weights."
  },
  "records": [
    {
      "id": "sdxl-base-checkpoint-foundation",
      "display_name": "SDXL Base Checkpoint",
      "category": "image",
      "base_model": "sdxl",
      "model_type": "checkpoint",
      "source_mode": "manual_only",
      "source": {
        "provider": "manual",
        "source_url": "",
        "notes": "Add the preferred SDXL base checkpoint source during catalog curation."
      },
      "install": {
        "target_type": "checkpoint",
        "backend_targets": [
          "comfyui",
          "forge"
        ],
        "comfyui_subdir": "models/checkpoints",
        "forge_subdir": "models/Stable-diffusion"
      },
      "ui": {
        "recommended": true,
        "creative_categories": [
          "base",
          "realistic",
          "general"
        ],
        "badges": [
          "foundation",
          "sdxl"
        ],
        "filter_group": "Image / SDXL / Checkpoints"
      },
      "hardware": {
        "minimum_vram": "8 GB",
        "recommended_vram": "12 GB+"
      },
      "license": {
        "requires_user_review": true,
        "notes": "User must confirm the model license from the source page."
      },
      "notes": [
        "Phase 1 entry is a guide placeholder until curated download sources are added."
      ]
    },
    {
      "id": "sdxl-lora-character-guide",
      "display_name": "SDXL Character LoRA",
      "category": "image",
      "base_model": "sdxl",
      "model_type": "lora",
      "source_mode": "discover_files",
      "source": {
        "provider": "civitai",
        "model_id": "",
        "version_id": "",
        "discovery": false,
        "notes": "Curated Civitai model/version IDs can be supplied by the manifest later or passed ad hoc through the Phase 5 Civitai discovery endpoint. Remote metadata/previews are session-only and are not persisted."
      },
      "file_rules": {
        "include_extensions": [
          ".safetensors",
          ".pt"
        ],
        "exclude_patterns": [
          "training",
          "dataset",
          "sample"
        ],
        "variant_detection": "safetensors_lora"
      },
      "install": {
        "target_type": "lora",
        "backend_targets": [
          "comfyui",
          "forge"
        ],
        "comfyui_subdir": "models/loras",
        "forge_subdir": "models/Lora"
      },
      "ui": {
        "recommended": false,
        "creative_categories": [
          "character"
        ],
        "badges": [
          "sdxl",
          "lora",
          "character"
        ],
        "filter_group": "Image / SDXL / LoRA / Character"
      },
      "license": {
        "requires_user_review": true,
        "notes": "Community model licenses vary by version."
      },
      "notes": [
        "Phase 5 can fetch Civitai metadata, versions, preview URLs, and file rows when a model_id or version_id is supplied. No downloads or token storage are enabled."
      ]
    },
    {
      "id": "sdxl-lora-style-guide",
      "display_name": "SDXL Style LoRA",
      "category": "image",
      "base_model": "sdxl",
      "model_type": "lora",
      "source_mode": "discover_files",
      "source": {
        "provider": "civitai",
        "model_id": "",
        "version_id": "",
        "discovery": false,
        "notes": "Curated Civitai model/version IDs can be supplied by the manifest later or passed ad hoc through the Phase 5 Civitai discovery endpoint. Remote metadata/previews are session-only and are not persisted."
      },
      "file_rules": {
        "include_extensions": [
          ".safetensors",
          ".pt"
        ],
        "exclude_patterns": [
          "training",
          "dataset",
          "sample"
        ],
        "variant_detection": "safetensors_lora"
      },
      "install": {
        "target_type": "lora",
        "backend_targets": [
          "comfyui",
          "forge"
        ],
        "comfyui_subdir": "models/loras",
        "forge_subdir": "models/Lora"
      },
      "ui": {
        "recommended": false,
        "creative_categories": [
          "style"
        ],
        "badges": [
          "sdxl",
          "lora",
          "style"
        ],
        "filter_group": "Image / SDXL / LoRA / Style"
      },
      "license": {
        "requires_user_review": true,
        "notes": "Community model licenses vary by version."
      },
      "notes": [
        "Phase 5 can fetch Civitai metadata, versions, preview URLs, and file rows when a model_id or version_id is supplied. No downloads or token storage are enabled."
      ]
    },
    {
      "id": "flux-gguf-unet-source-guide",
      "display_name": "Flux GGUF UNet Source",
      "category": "image",
      "base_model": "flux",
      "model_type": "unet_gguf",
      "source_mode": "discover_files",
      "source": {
        "provider": "huggingface",
        "repo": "",
        "path": "",
        "revision": "main",
        "discovery": false,
        "notes": "Curated Hugging Face repo IDs are added later. Phase 1 only defines GGUF discovery shape and install routing."
      },
      "file_rules": {
        "include_extensions": [
          ".gguf"
        ],
        "exclude_patterns": [
          "README",
          "LICENSE",
          "mmproj"
        ],
        "variant_detection": "gguf_quant",
        "quant_patterns": [
          "Q2_K",
          "Q3_K_S",
          "Q3_K_M",
          "Q3_K_L",
          "Q4_0",
          "Q4_K_S",
          "Q4_K_M",
          "Q5_0",
          "Q5_K_S",
          "Q5_K_M",
          "Q6_K",
          "Q8_0",
          "F16",
          "BF16"
        ]
      },
      "install": {
        "target_type": "unet_gguf",
        "backend_targets": [
          "comfyui"
        ],
        "comfyui_subdir": "models/unet"
      },
      "ui": {
        "recommended": true,
        "creative_categories": [
          "base",
          "gguf"
        ],
        "recommended_variants": [
          "Q4_K_M",
          "Q5_K_M"
        ],
        "badges": [
          "flux",
          "gguf",
          "dynamic-source"
        ],
        "filter_group": "Image / Flux / GGUF"
      },
      "hardware": {
        "minimum_vram": "8 GB",
        "recommended_vram": "12 GB+"
      },
      "license": {
        "requires_user_review": true,
        "notes": "User must confirm source license and access requirements."
      },
      "notes": [
        "This entry proves repo/folder-level discovery without storing every quant as a separate manifest record."
      ]
    },
    {
      "id": "llm-gguf-roleplay-source-guide",
      "display_name": "Roleplay LLM GGUF Source",
      "category": "llm",
      "base_model": "general",
      "model_type": "llm_gguf",
      "source_mode": "discover_files",
      "source": {
        "provider": "huggingface",
        "repo": "",
        "path": "",
        "revision": "main",
        "discovery": false,
        "notes": "Curated Hugging Face repo IDs are added later. Phase 1 only defines LLM GGUF discovery shape and routing."
      },
      "file_rules": {
        "include_extensions": [
          ".gguf"
        ],
        "exclude_patterns": [
          "README",
          "LICENSE",
          "mmproj"
        ],
        "variant_detection": "gguf_quant",
        "quant_patterns": [
          "Q2_K",
          "Q3_K_S",
          "Q3_K_M",
          "Q4_K_M",
          "Q5_K_M",
          "Q6_K",
          "Q8_0"
        ]
      },
      "install": {
        "target_type": "llm_gguf",
        "backend_targets": [
          "koboldcpp",
          "local_llm"
        ],
        "path_rule": "user_llm_models_root"
      },
      "ui": {
        "recommended": true,
        "creative_categories": [
          "roleplay",
          "chat",
          "assistant"
        ],
        "recommended_variants": [
          "Q4_K_M",
          "Q5_K_M"
        ],
        "badges": [
          "llm",
          "gguf",
          "dynamic-source"
        ],
        "filter_group": "LLM / Roleplay / GGUF"
      },
      "hardware": {
        "minimum_vram": "CPU/GPU dependent",
        "recommended_vram": "Depends on quant and context size"
      },
      "license": {
        "requires_user_review": true,
        "notes": "LLM model licenses vary significantly by source."
      },
      "notes": [
        "LLM paths are user-owned and must be configured under neo_data in later phases."
      ]
    },
    {
      "id": "controlnet-depth-guide",
      "display_name": "ControlNet Depth Model",
      "category": "image",
      "base_model": "sdxl",
      "model_type": "controlnet",
      "source_mode": "manual_only",
      "source": {
        "provider": "manual",
        "source_url": "",
        "notes": "Curated ControlNet source is added later. Phase 1 declares routing and UI grouping."
      },
      "install": {
        "target_type": "controlnet",
        "backend_targets": [
          "comfyui"
        ],
        "comfyui_subdir": "models/controlnet"
      },
      "ui": {
        "recommended": false,
        "creative_categories": [